{
  "$schema": "https://json-schema.org/draft/2020-12/schema",
  "$id": "urn:zenblog:metadata-registry:1.0.0",
  "title": "Metadata Registry 1.0.0",
  "type": "object",
  "required": ["schemaVersion", "vocabularyVersion", "updatedAt", "records"],
  "properties": {
    "schemaVersion": { "const": "1.0.0" },
    "vocabularyVersion": { "const": "1.0.0" },
    "updatedAt": { "type": ["string", "null"] },
    "records": { "type": "object" }
  }
}
